[{"confidence":1.0,"direction":"undirected","evidence_ids":["evidence:synthetic_meridian_note:2"],"extractor":{"model":"gpt-5.6-luna","prompt_version":"demo-candidate-v1","worker_id":"luna-demo-worker"},"member_subtype":null,"note":"Synthetic demonstration relation.","relation_id":"rel:demo_aylin_bora_output","relation_type":"academic_output","source_entity_id":"person:aylin_demo","status":"accepted","target_entity_id":"person:bora_example","verifier":{"model":"gpt-5.6-sol","prompt_version":"demo-verify-v1","verdict":"accept","worker_id":"sol-demo-reviewer"}},{"confidence":1.0,"direction":"undirected","evidence_ids":["evidence:synthetic_meridian_note:3"],"extractor":{"model":"gpt-5.6-luna","prompt_version":"demo-candidate-v1","worker_id":"luna-demo-worker"},"member_subtype":null,"note":"Synthetic demonstration relation.","relation_id":"rel:demo_aylin_cem_context","relation_type":"in_same_context","source_entity_id":"person:aylin_demo","status":"accepted","target_entity_id":"person:cem_sample","verifier":{"model":"gpt-5.6-sol","prompt_version":"demo-verify-v1","verdict":"accept","worker_id":"sol-demo-reviewer"}},{"confidence":1.0,"direction":"directed","evidence_ids":["evidence:synthetic_meridian_note:1"],"extractor":{"model":"gpt-5.6-luna","prompt_version":"demo-candidate-v1","worker_id":"luna-demo-worker"},"member_subtype":null,"note":"Synthetic demonstration relation.","relation_id":"rel:demo_bora_aylin_teacher","relation_type":"student_teacher","source_entity_id":"person:bora_example","status":"accepted","target_entity_id":"person:aylin_demo","verifier":{"model":"gpt-5.6-sol","prompt_version":"demo-verify-v1","verdict":"accept","worker_id":"sol-demo-reviewer"}}]
